{
  "schema_version": "1.0.0",
  "trade_id": "DF-2026-0001",
  "version": 1,
  "status": "pending_human",
  "ticker": "XYZ",
  "setup": "catalyst_breakout",
  "direction": "long",
  "instrument": "stock",
  "catalyst": {
    "quality": "primary",
    "summary": "A named customer announced a two-year supply agreement before the open.",
    "source_url": "https://example.com/xyz-supply-agreement",
    "source_type": "news",
    "observed_at": "2026-09-25T08:10:00-05:00",
    "earnings_in_window": false
  },
  "why_now": "Primary catalyst plus a breakout through 84.20 on 2.4x relative volume, within 1 ATR of the level.",
  "entry": {
    "trigger": "buy_stop",
    "price": 84.5,
    "max_fill": 84.63
  },
  "stop": 80.75,
  "targets": [{ "price": 91.0, "fraction": 1 }],
  "time_stop": {
    "max_calendar_days": 7,
    "entry_session_date": "2026-09-25",
    "exit_session_date": "2026-10-02"
  },
  "sizing": {
    "equity_at_decision": 100000,
    "units": 171,
    "planned_loss": 663.48,
    "heat_contribution": 995.22,
    "open_heat_before": 0,
    "book_heat_cap": 2000,
    "name_heat_cap": 1000,
    "notional": 14471.73,
    "gap_multiplier": 1.5,
    "expected_reward": 1089.27,
    "expected_r": 1.6418,
    "initial_risk": 663.48
  },
  "invalidation": ["stop_hit", "level_lost", "time_stop", "catalyst_retracted"],
  "invalidation_level": 80.75,
  "evidence": {
    "news": ["https://example.com/xyz-supply-agreement"],
    "sec": [],
    "x": [],
    "relative_volume": 2.4,
    "options_note": "Call volume elevated. No hard block.",
    "price_action": "Broke 84.20 and held above VWAP."
  },
  "red_team": {
    "decision": "pass",
    "hard_blocks": [],
    "warnings": [],
    "narrative": "Single-customer concentration is noted. It is not one of the seven warning flags."
  },
  "risk_decision": {
    "decision": "APPROVED",
    "reasons": [],
    "risk_mode": "normal",
    "entries_allowed": true
  },
  "human_decision": null,
  "watcher": null,
  "created_at": "2026-09-25T08:40:00-05:00",
  "frozen_at": null
}
